<?xml version="1.0" encoding="UTF-8"?>
<xs:schema attributeFormDefault="unqualified"
           elementFormDefault="qualified"
           xmlns="http://stanovnik.net/ParallelTimetables subjects.xsd"
           xmlns:xs="http://www.w3.org/2001/XMLSchema"
           targetNamespace="http://stanovnik.net/ParallelTimetables">
    <xs:element name="subjects">
        <xs:complexType>
            <xs:sequence>
                <xs:element name="subject" maxOccurs="unbounded" minOccurs="1">
                    <xs:complexType>
                        <xs:sequence>
                            <xs:element name="lecture_classrooms">
                                <xs:complexType>
                                    <xs:sequence>
                                        <xs:element name="id" type="xs:integer" maxOccurs="unbounded" minOccurs="1"/>
                                    </xs:sequence>
                                </xs:complexType>
                            </xs:element>
                            <xs:element name="tutorial_classrooms">
                                <xs:complexType>
                                    <xs:sequence>
                                        <xs:element name="id" type="xs:integer" maxOccurs="unbounded" minOccurs="1"/>
                                    </xs:sequence>
                                </xs:complexType>
                            </xs:element>
                            <xs:element name="professors">
                                <xs:complexType>
                                    <xs:sequence>
                                        <xs:element name="id" type="xs:integer" maxOccurs="3" minOccurs="1"/>
                                    </xs:sequence>
                                </xs:complexType>
                            </xs:element>
                            <xs:element name="assistants">
                                <xs:complexType>
                                    <xs:sequence>
                                        <xs:element name="id" maxOccurs="unbounded" minOccurs="1">
                                            <xs:complexType>
                                                <xs:simpleContent>
                                                    <xs:extension base="xs:double">
                                                        <xs:attribute type="xs:double" name="weight" use="optional"/>
                                                    </xs:extension>
                                                </xs:simpleContent>
                                            </xs:complexType>
                                        </xs:element>
                                    </xs:sequence>
                                </xs:complexType>
                            </xs:element>
                        </xs:sequence>
                        <xs:attribute name="id" type="xs:integer" use="required"/>
                    </xs:complexType>
                </xs:element>
            </xs:sequence>
        </xs:complexType>
    </xs:element>
</xs:schema>
